<?xml version="1.0" encoding="UTF-8" standalone="no"?>
<!DOCTYPE data SYSTEM 'structureXML.dtd'>
<data>
    <date>12/12/2020</date>

    <tests>
        <test scale="region" region="FR-CVL">
            <positifs>190</positifs>
            <total>1400</total>
        </test>

        <test scale="france">
            <positifs>54110</positifs>
            <total>140000</total>
        </test>

        <test scale="departement" departement="58">
            <positifs>400</positifs>
            <total>1000</total>
        </test>
    </tests>

    <hospitalises>

        <reanimation scale="region" region="FR-ARA">
            <total>7600</total>
            <nouveaux>35</nouveaux>
        </reanimation>

        <retour_domicile scale="france">
            <total>7800</total>
            <nouveaux>40</nouveaux>
        </retour_domicile>

        <decede scale="departement" departement="21" >
            <total></total>
            <nouveaux></nouveaux>
        </decede>

    </hospitalises>
</data>